{
  "artifactType": "operations_bundle",
  "artifactId": "artifact_ops_0001",
  "title": "Launch Operations Bundle",
  "generatedAt": "2026-05-09T21:05:00.000Z",
  "summary": "The orchestrated workflow produced a vendor stack and launch-ready plan after governed portfolio spend.",
  "deliverables": [
    "Vendor short list",
    "Workflow software selection",
    "Launch readiness checklist"
  ]
}
