{
  "artifactType": "research_brief",
  "artifactId": "artifact_research_0001",
  "title": "Market Intelligence Brief",
  "generatedAt": "2026-05-09T21:00:00.000Z",
  "summary": "The governed purchase unlocked premium research signals and produced a concise competitive brief.",
  "deliverables": [
    "Executive summary",
    "Competitive gap analysis",
    "Recommended market wedge"
  ]
}
